{
  "artifact_kind": "eduai_native_pedagogy_artifact",
  "artifact_schema_version": "model_artifact.v1",
  "model_version": "example-untrained-contract-artifact-v1",
  "created_at": "2026-01-15T10:00:00Z",
  "factor_space_version": "factor_space.v1",
  "training_data": {
    "source_summary": "Schema validation example only; no real training data.",
    "observation_count": 1,
    "source_kinds": [
      "synthetic"
    ]
  },
  "target_definition": {
    "primary_target": "expected_next_step_success",
    "secondary_targets": [
      "expected_learning_gain_proxy",
      "uncertainty"
    ],
    "formula_description": "Future scorer estimates outcome from pre-decision features and a complete six-factor candidate_config."
  },
  "feature_schema": {
    "schema_version": "training_observation.v1",
    "allowed_input_block": "pre_decision_features",
    "forbidden_inputs": [
      "outcome.post_score",
      "outcome.next_step_success",
      "outcome.normalized_learning_gain"
    ]
  },
  "candidate_schema": {
    "factor_space_version": "factor_space.v1",
    "required_factors": [
      "difficulty",
      "depth",
      "support_level",
      "presentation_format",
      "examples_level",
      "terminology_level"
    ]
  },
  "model": {
    "model_family": "untrained_contract_example",
    "parameters": {},
    "weights_or_serialized_payload": null
  },
  "evaluation": {
    "split_strategy": "not_evaluated_example_only",
    "metrics": {},
    "baseline_comparison": {}
  },
  "compatibility": {
    "app_min_version": null,
    "contract_version": "pedagogy_policy_contract_v1"
  },
  "limitations": [
    "Example artifact only; contains no trained weights.",
    "Must not be used for runtime scoring.",
    "Does not prove six-factor effectiveness."
  ]
}
